No.,Time,TCP Delta,Source,Destination,TCP Segment Len,Bytes in flight,Calculated window size,Info,Phase
1,0.000000,0.000000000,192.168.10.184,192.168.10.196,0,,65535,52343  >  5201 [SYN] Seq=0 Win=65535 Len=0 MSS=1460 WS=64 SACK_PERM=1 TSval=2027714706 TSecr=0,---
2,0.105354,0.105354000,192.168.10.196,192.168.10.184,0,,65535,"5201  >  52343 [SYN, ACK] Seq=0 Ack=1 Win=65535 Len=0 MSS=1460 WS=4 SACK_PERM=1",---
3,0.105449,0.000095000,192.168.10.184,192.168.10.196,0,,262144,52343  >  5201 [ACK] Seq=1 Ack=1 Win=262144 Len=0,---
4,0.105480,0.000031000,192.168.10.184,192.168.10.196,37,37,262144,"52343  >  5201 [PSH, ACK] Seq=1 Ack=1 Win=262144 Len=37",---
5,0.268582,0.163102000,192.168.10.196,192.168.10.184,0,,212952,5201  >  52343 [ACK] Seq=1 Ack=38 Win=212952 Len=0,---
6,0.350994,0.082412000,192.168.10.184,192.168.10.196,1460,1460,262144,52343  >  5201 [ACK] Seq=38 Ack=1 Win=262144 Len=1460,---
7,0.350994,0.000000000,192.168.10.184,192.168.10.196,1460,2920,262144,52343  >  5201 [ACK] Seq=1498 Ack=1 Win=262144 Len=1460,---
8,0.350995,0.000001000,192.168.10.184,192.168.10.196,1460,4380,262144,52343  >  5201 [ACK] Seq=2958 Ack=1 Win=262144 Len=1460,---
9,0.350995,0.000000000,192.168.10.184,192.168.10.196,1460,5840,262144,52343  >  5201 [ACK] Seq=4418 Ack=1 Win=262144 Len=1460,---
10,0.351003,0.000008000,192.168.10.184,192.168.10.196,1460,7300,262144,52343  >  5201 [ACK] Seq=5878 Ack=1 Win=262144 Len=1460,---
11,0.351004,0.000001000,192.168.10.184,192.168.10.196,1460,8760,262144,52343  >  5201 [ACK] Seq=7338 Ack=1 Win=262144 Len=1460,---
12,0.351004,0.000000000,192.168.10.184,192.168.10.196,1460,10220,262144,52343  >  5201 [ACK] Seq=8798 Ack=1 Win=262144 Len=1460,---
13,0.351004,0.000000000,192.168.10.184,192.168.10.196,1460,11680,262144,52343  >  5201 [ACK] Seq=10258 Ack=1 Win=262144 Len=1460,---
14,0.460172,0.109168000,192.168.10.196,192.168.10.184,0,,212992,5201  >  52343 [ACK] Seq=1 Ack=11718 Win=212992 Len=0,---
15,0.460234,0.000062000,192.168.10.184,192.168.10.196,1460,1460,262144,52343  >  5201 [ACK] Seq=11718 Ack=1 Win=262144 Len=1460,---
16,0.460234,0.000000000,192.168.10.184,192.168.10.196,1460,2920,262144,52343  >  5201 [ACK] Seq=13178 Ack=1 Win=262144 Len=1460,---
17,0.460235,0.000001000,192.168.10.184,192.168.10.196,1460,4380,262144,52343  >  5201 [ACK] Seq=14638 Ack=1 Win=262144 Len=1460,---
18,0.460235,0.000000000,192.168.10.184,192.168.10.196,1460,5840,262144,52343  >  5201 [ACK] Seq=16098 Ack=1 Win=262144 Len=1460,---
19,0.460236,0.000001000,192.168.10.184,192.168.10.196,1460,7300,262144,52343  >  5201 [ACK] Seq=17558 Ack=1 Win=262144 Len=1460,---
20,0.460236,0.000000000,192.168.10.184,192.168.10.196,1460,8760,262144,52343  >  5201 [ACK] Seq=19018 Ack=1 Win=262144 Len=1460,---
21,0.460237,0.000001000,192.168.10.184,192.168.10.196,1460,10220,262144,52343  >  5201 [ACK] Seq=20478 Ack=1 Win=262144 Len=1460,---
22,0.460237,0.000000000,192.168.10.184,192.168.10.196,1460,11680,262144,52343  >  5201 [ACK] Seq=21938 Ack=1 Win=262144 Len=1460,---
23,0.460238,0.000001000,192.168.10.184,192.168.10.196,1460,13140,262144,52343  >  5201 [ACK] Seq=23398 Ack=1 Win=262144 Len=1460,---
24,0.460238,0.000000000,192.168.10.184,192.168.10.196,1460,14600,262144,52343  >  5201 [ACK] Seq=24858 Ack=1 Win=262144 Len=1460,---
25,0.592291,0.132053000,192.168.10.196,192.168.10.184,0,,212992,5201  >  52343 [ACK] Seq=1 Ack=26318 Win=212992 Len=0,---
26,0.592451,0.000160000,192.168.10.184,192.168.10.196,1460,1460,262144,52343  >  5201 [ACK] Seq=26318 Ack=1 Win=262144 Len=1460,---
27,0.592454,0.000003000,192.168.10.184,192.168.10.196,1460,2920,262144,52343  >  5201 [ACK] Seq=27778 Ack=1 Win=262144 Len=1460,---
28,0.592455,0.000001000,192.168.10.184,192.168.10.196,1460,4380,262144,52343  >  5201 [ACK] Seq=29238 Ack=1 Win=262144 Len=1460,---
29,0.592455,0.000000000,192.168.10.184,192.168.10.196,1460,5840,262144,52343  >  5201 [ACK] Seq=30698 Ack=1 Win=262144 Len=1460,---
30,0.592457,0.000002000,192.168.10.184,192.168.10.196,1460,7300,262144,52343  >  5201 [ACK] Seq=32158 Ack=1 Win=262144 Len=1460,---
31,0.592458,0.000001000,192.168.10.184,192.168.10.196,1460,8760,262144,52343  >  5201 [ACK] Seq=33618 Ack=1 Win=262144 Len=1460[Packet size limited during capture],---
32,0.592459,0.000001000,192.168.10.184,192.168.10.196,1460,10220,262144,52343  >  5201 [ACK] Seq=35078 Ack=1 Win=262144 Len=1460,---
33,0.592460,0.000001000,192.168.10.184,192.168.10.196,1460,11680,262144,52343  >  5201 [ACK] Seq=36538 Ack=1 Win=262144 Len=1460,---
34,0.592460,0.000000000,192.168.10.184,192.168.10.196,1460,13140,262144,52343  >  5201 [ACK] Seq=37998 Ack=1 Win=262144 Len=1460,---
35,0.592462,0.000002000,192.168.10.184,192.168.10.196,1460,14600,262144,52343  >  5201 [ACK] Seq=39458 Ack=1 Win=262144 Len=1460,---
36,0.592463,0.000001000,192.168.10.184,192.168.10.196,1460,16060,262144,52343  >  5201 [ACK] Seq=40918 Ack=1 Win=262144 Len=1460,---
37,0.592464,0.000001000,192.168.10.184,192.168.10.196,1460,17520,262144,52343  >  5201 [ACK] Seq=42378 Ack=1 Win=262144 Len=1460,---
38,0.714379,0.121915000,192.168.10.196,192.168.10.184,0,,212992,5201  >  52343 [ACK] Seq=1 Ack=43838 Win=212992 Len=0,---
39,0.714538,0.000159000,192.168.10.184,192.168.10.196,1460,1460,262144,52343  >  5201 [ACK] Seq=43838 Ack=1 Win=262144 Len=1460,---
40,0.714540,0.000002000,192.168.10.184,192.168.10.196,1460,2920,262144,52343  >  5201 [ACK] Seq=45298 Ack=1 Win=262144 Len=1460,---
41,0.714540,0.000000000,192.168.10.184,192.168.10.196,1460,4380,262144,52343  >  5201 [ACK] Seq=46758 Ack=1 Win=262144 Len=1460,---
42,0.714541,0.000001000,192.168.10.184,192.168.10.196,1460,5840,262144,52343  >  5201 [ACK] Seq=48218 Ack=1 Win=262144 Len=1460[Packet size limited during capture],---
43,0.714542,0.000001000,192.168.10.184,192.168.10.196,1460,7300,262144,52343  >  5201 [ACK] Seq=49678 Ack=1 Win=262144 Len=1460,---
44,0.714543,0.000001000,192.168.10.184,192.168.10.196,1460,8760,262144,52343  >  5201 [ACK] Seq=51138 Ack=1 Win=262144 Len=1460,---
45,0.714543,0.000000000,192.168.10.184,192.168.10.196,1460,10220,262144,52343  >  5201 [ACK] Seq=52598 Ack=1 Win=262144 Len=1460,---
46,0.714544,0.000001000,192.168.10.184,192.168.10.196,1460,11680,262144,52343  >  5201 [ACK] Seq=54058 Ack=1 Win=262144 Len=1460,---
47,0.714545,0.000001000,192.168.10.184,192.168.10.196,1460,13140,262144,52343  >  5201 [ACK] Seq=55518 Ack=1 Win=262144 Len=1460,---
48,0.714546,0.000001000,192.168.10.184,192.168.10.196,1460,14600,262144,52343  >  5201 [ACK] Seq=56978 Ack=1 Win=262144 Len=1460,---
49,0.714546,0.000000000,192.168.10.184,192.168.10.196,1460,16060,262144,52343  >  5201 [ACK] Seq=58438 Ack=1 Win=262144 Len=1460,---
50,0.714548,0.000002000,192.168.10.184,192.168.10.196,1460,17520,262144,52343  >  5201 [ACK] Seq=59898 Ack=1 Win=262144 Len=1460,---
51,0.714549,0.000001000,192.168.10.184,192.168.10.196,1460,18980,262144,52343  >  5201 [ACK] Seq=61358 Ack=1 Win=262144 Len=1460,---
52,0.714550,0.000001000,192.168.10.184,192.168.10.196,1460,20440,262144,52343  >  5201 [ACK] Seq=62818 Ack=1 Win=262144 Len=1460,---
53,0.836374,0.121824000,192.168.10.196,192.168.10.184,0,,212992,5201  >  52343 [ACK] Seq=1 Ack=64278 Win=212992 Len=0,---
54,0.836513,0.000139000,192.168.10.184,192.168.10.196,1460,1460,262144,52343  >  5201 [ACK] Seq=64278 Ack=1 Win=262144 Len=1460,---
55,0.836515,0.000002000,192.168.10.184,192.168.10.196,1460,2920,262144,52343  >  5201 [ACK] Seq=65738 Ack=1 Win=262144 Len=1460,---
56,0.836516,0.000001000,192.168.10.184,192.168.10.196,1460,4380,262144,52343  >  5201 [ACK] Seq=67198 Ack=1 Win=262144 Len=1460,---
57,0.836517,0.000001000,192.168.10.184,192.168.10.196,1460,5840,262144,52343  >  5201 [ACK] Seq=68658 Ack=1 Win=262144 Len=1460,---
58,0.836518,0.000001000,192.168.10.184,192.168.10.196,1460,7300,262144,52343  >  5201 [ACK] Seq=70118 Ack=1 Win=262144 Len=1460,---
59,0.836520,0.000002000,192.168.10.184,192.168.10.196,1460,8760,262144,52343  >  5201 [ACK] Seq=71578 Ack=1 Win=262144 Len=1460,---
60,0.836521,0.000001000,192.168.10.184,192.168.10.196,1460,10220,262144,52343  >  5201 [ACK] Seq=73038 Ack=1 Win=262144 Len=1460,---
61,0.836522,0.000001000,192.168.10.184,192.168.10.196,1460,11680,262144,52343  >  5201 [ACK] Seq=74498 Ack=1 Win=262144 Len=1460,---
62,0.836523,0.000001000,192.168.10.184,192.168.10.196,1460,13140,262144,52343  >  5201 [ACK] Seq=75958 Ack=1 Win=262144 Len=1460,---
63,0.836524,0.000001000,192.168.10.184,192.168.10.196,1460,14600,262144,52343  >  5201 [ACK] Seq=77418 Ack=1 Win=262144 Len=1460,---
64,0.836526,0.000002000,192.168.10.184,192.168.10.196,1460,16060,262144,52343  >  5201 [ACK] Seq=78878 Ack=1 Win=262144 Len=1460,---
65,0.836526,0.000000000,192.168.10.184,192.168.10.196,1460,17520,262144,52343  >  5201 [ACK] Seq=80338 Ack=1 Win=262144 Len=1460,---
66,0.836661,0.000135000,192.168.10.184,192.168.10.196,1460,18980,262144,52343  >  5201 [ACK] Seq=81798 Ack=1 Win=262144 Len=1460,---
67,0.836662,0.000001000,192.168.10.184,192.168.10.196,1460,20440,262144,52343  >  5201 [ACK] Seq=83258 Ack=1 Win=262144 Len=1460,---
68,0.836663,0.000001000,192.168.10.184,192.168.10.196,1460,21900,262144,52343  >  5201 [ACK] Seq=84718 Ack=1 Win=262144 Len=1460,---
69,0.836664,0.000001000,192.168.10.184,192.168.10.196,1460,23360,262144,52343  >  5201 [ACK] Seq=86178 Ack=1 Win=262144 Len=1460,---
70,0.958504,0.121840000,192.168.10.196,192.168.10.184,0,,212992,5201  >  52343 [ACK] Seq=1 Ack=67198 Win=212992 Len=0,---
71,0.958561,0.000057000,192.168.10.184,192.168.10.196,1460,21900,262144,52343  >  5201 [ACK] Seq=87638 Ack=1 Win=262144 Len=1460,---
72,0.958561,0.000000000,192.168.10.184,192.168.10.196,1460,23360,262144,52343  >  5201 [ACK] Seq=89098 Ack=1 Win=262144 Len=1460,---
73,0.958561,0.000000000,192.168.10.184,192.168.10.196,1460,24820,262144,52343  >  5201 [ACK] Seq=90558 Ack=1 Win=262144 Len=1460,---
74,0.958562,0.000001000,192.168.10.184,192.168.10.196,1460,26280,262144,52343  >  5201 [ACK] Seq=92018 Ack=1 Win=262144 Len=1460,---
75,0.960054,0.001492000,192.168.10.196,192.168.10.184,0,,212992,5201  >  52343 [ACK] Seq=1 Ack=80338 Win=212992 Len=0,---
76,0.960096,0.000042000,192.168.10.184,192.168.10.196,1460,14600,262144,52343  >  5201 [ACK] Seq=93478 Ack=1 Win=262144 Len=1460,---
77,0.960096,0.000000000,192.168.10.184,192.168.10.196,1460,16060,262144,52343  >  5201 [ACK] Seq=94938 Ack=1 Win=262144 Len=1460,---
78,0.960096,0.000000000,192.168.10.184,192.168.10.196,1460,17520,262144,52343  >  5201 [ACK] Seq=96398 Ack=1 Win=262144 Len=1460,---
79,0.960097,0.000001000,192.168.10.184,192.168.10.196,1460,18980,262144,52343  >  5201 [ACK] Seq=97858 Ack=1 Win=262144 Len=1460,---
80,0.960097,0.000000000,192.168.10.184,192.168.10.196,1460,20440,262144,52343  >  5201 [ACK] Seq=99318 Ack=1 Win=262144 Len=1460,---
81,0.960097,0.000000000,192.168.10.184,192.168.10.196,1460,21900,262144,52343  >  5201 [ACK] Seq=100778 Ack=1 Win=262144 Len=1460,---
82,0.960098,0.000001000,192.168.10.184,192.168.10.196,1460,23360,262144,52343  >  5201 [ACK] Seq=102238 Ack=1 Win=262144 Len=1460,---
83,0.960098,0.000000000,192.168.10.184,192.168.10.196,1460,24820,262144,52343  >  5201 [ACK] Seq=103698 Ack=1 Win=262144 Len=1460,---
84,0.960098,0.000000000,192.168.10.184,192.168.10.196,1460,26280,262144,52343  >  5201 [ACK] Seq=105158 Ack=1 Win=262144 Len=1460,---
85,0.960099,0.000001000,192.168.10.184,192.168.10.196,1460,27740,262144,52343  >  5201 [ACK] Seq=106618 Ack=1 Win=262144 Len=1460,---
86,0.960099,0.000000000,192.168.10.184,192.168.10.196,1460,29200,262144,52343  >  5201 [ACK] Seq=108078 Ack=1 Win=262144 Len=1460,---
87,0.961039,0.000940000,192.168.10.196,192.168.10.184,0,,212992,5201  >  52343 [ACK] Seq=1 Ack=86178 Win=212992 Len=0,---
88,0.961071,0.000032000,192.168.10.184,192.168.10.196,1460,24820,262144,52343  >  5201 [ACK] Seq=109538 Ack=1 Win=262144 Len=1460,---
89,0.961072,0.000001000,192.168.10.184,192.168.10.196,1460,26280,262144,52343  >  5201 [ACK] Seq=110998 Ack=1 Win=262144 Len=1460,---
90,0.961072,0.000000000,192.168.10.184,192.168.10.196,1460,27740,262144,52343  >  5201 [ACK] Seq=112458 Ack=1 Win=262144 Len=1460,---
91,0.961072,0.000000000,192.168.10.184,192.168.10.196,1460,29200,262144,52343  >  5201 [ACK] Seq=113918 Ack=1 Win=262144 Len=1460,---
92,0.961072,0.000000000,192.168.10.184,192.168.10.196,1460,30660,262144,52343  >  5201 [ACK] Seq=115378 Ack=1 Win=262144 Len=1460,---
93,0.961073,0.000001000,192.168.10.184,192.168.10.196,1460,32120,262144,52343  >  5201 [ACK] Seq=116838 Ack=1 Win=262144 Len=1460,---
94,0.962944,0.001871000,192.168.10.196,192.168.10.184,0,,212992,5201  >  52343 [ACK] Seq=1 Ack=87638 Win=212992 Len=0,---
95,0.962972,0.000028000,192.168.10.184,192.168.10.196,1460,32120,262144,52343  >  5201 [ACK] Seq=118298 Ack=1 Win=262144 Len=1460,---
96,0.962972,0.000000000,192.168.10.184,192.168.10.196,1460,33580,262144,52343  >  5201 [ACK] Seq=119758 Ack=1 Win=262144 Len=1460,---
97,1.073041,0.110069000,192.168.10.196,192.168.10.184,0,,212992,5201  >  52343 [ACK] Seq=1 Ack=93478 Win=212992 Len=0,---
98,1.073164,0.000123000,192.168.10.184,192.168.10.196,1460,29200,262144,52343  >  5201 [ACK] Seq=121218 Ack=1 Win=262144 Len=1460,---
99,1.073165,0.000001000,192.168.10.184,192.168.10.196,1460,30660,262144,52343  >  5201 [ACK] Seq=122678 Ack=1 Win=262144 Len=1460,---
100,1.073166,0.000001000,192.168.10.184,192.168.10.196,1460,32120,262144,52343  >  5201 [ACK] Seq=124138 Ack=1 Win=262144 Len=1460,---
101,1.073167,0.000001000,192.168.10.184,192.168.10.196,1460,33580,262144,52343  >  5201 [ACK] Seq=125598 Ack=1 Win=262144 Len=1460,---
102,1.073168,0.000001000,192.168.10.184,192.168.10.196,1460,35040,262144,52343  >  5201 [ACK] Seq=127058 Ack=1 Win=262144 Len=1460,---
103,1.073169,0.000001000,192.168.10.184,192.168.10.196,1460,36500,262144,52343  >  5201 [ACK] Seq=128518 Ack=1 Win=262144 Len=1460,---
104,1.074699,0.001530000,192.168.10.196,192.168.10.184,0,,212992,5201  >  52343 [ACK] Seq=1 Ack=109538 Win=212992 Len=0,---
105,1.074839,0.000140000,192.168.10.184,192.168.10.196,1460,21900,262144,52343  >  5201 [ACK] Seq=129978 Ack=1 Win=262144 Len=1460,---
106,1.074840,0.000001000,192.168.10.184,192.168.10.196,1460,23360,262144,52343  >  5201 [ACK] Seq=131438 Ack=1 Win=262144 Len=1460,---
107,1.074841,0.000001000,192.168.10.184,192.168.10.196,1460,24820,262144,52343  >  5201 [ACK] Seq=132898 Ack=1 Win=262144 Len=1460,---
108,1.074842,0.000001000,192.168.10.184,192.168.10.196,1460,26280,262144,52343  >  5201 [ACK] Seq=134358 Ack=1 Win=262144 Len=1460,---
109,1.074843,0.000001000,192.168.10.184,192.168.10.196,1460,27740,262144,52343  >  5201 [ACK] Seq=135818 Ack=1 Win=262144 Len=1460,---
110,1.074844,0.000001000,192.168.10.184,192.168.10.196,1460,29200,262144,52343  >  5201 [ACK] Seq=137278 Ack=1 Win=262144 Len=1460,---
111,1.074845,0.000001000,192.168.10.184,192.168.10.196,1460,30660,262144,52343  >  5201 [ACK] Seq=138738 Ack=1 Win=262144 Len=1460,---
112,1.074846,0.000001000,192.168.10.184,192.168.10.196,1460,32120,262144,52343  >  5201 [ACK] Seq=140198 Ack=1 Win=262144 Len=1460,---
113,1.074847,0.000001000,192.168.10.184,192.168.10.196,1460,33580,262144,52343  >  5201 [ACK] Seq=141658 Ack=1 Win=262144 Len=1460,---
114,1.074848,0.000001000,192.168.10.184,192.168.10.196,1460,35040,262144,52343  >  5201 [ACK] Seq=143118 Ack=1 Win=262144 Len=1460,---
115,1.074848,0.000000000,192.168.10.184,192.168.10.196,1460,36500,262144,52343  >  5201 [ACK] Seq=144578 Ack=1 Win=262144 Len=1460,---
116,1.074850,0.000002000,192.168.10.184,192.168.10.196,1460,37960,262144,52343  >  5201 [ACK] Seq=146038 Ack=1 Win=262144 Len=1460,---
117,1.074851,0.000001000,192.168.10.184,192.168.10.196,1460,39420,262144,52343  >  5201 [ACK] Seq=147498 Ack=1 Win=262144 Len=1460,---
118,1.076119,0.001268000,192.168.10.196,192.168.10.184,0,,212992,5201  >  52343 [ACK] Seq=1 Ack=118298 Win=212992 Len=0,---
119,1.076243,0.000124000,192.168.10.184,192.168.10.196,1460,32120,262144,52343  >  5201 [ACK] Seq=148958 Ack=1 Win=262144 Len=1460,---
120,1.076245,0.000002000,192.168.10.184,192.168.10.196,1460,33580,262144,52343  >  5201 [ACK] Seq=150418 Ack=1 Win=262144 Len=1460,---
121,1.076246,0.000001000,192.168.10.184,192.168.10.196,1460,35040,262144,52343  >  5201 [ACK] Seq=151878 Ack=1 Win=262144 Len=1460,---
122,1.076247,0.000001000,192.168.10.184,192.168.10.196,1460,36500,262144,52343  >  5201 [ACK] Seq=153338 Ack=1 Win=262144 Len=1460,---
123,1.076248,0.000001000,192.168.10.184,192.168.10.196,1460,37960,262144,52343  >  5201 [ACK] Seq=154798 Ack=1 Win=262144 Len=1460,---
124,1.076248,0.000000000,192.168.10.184,192.168.10.196,1460,39420,262144,52343  >  5201 [ACK] Seq=156258 Ack=1 Win=262144 Len=1460,---
125,1.076249,0.000001000,192.168.10.184,192.168.10.196,1460,40880,262144,52343  >  5201 [ACK] Seq=157718 Ack=1 Win=262144 Len=1460,---
126,1.076250,0.000001000,192.168.10.184,192.168.10.196,1460,42340,262144,52343  >  5201 [ACK] Seq=159178 Ack=1 Win=262144 Len=1460,---
127,1.076762,0.000512000,192.168.10.196,192.168.10.184,0,,212992,5201  >  52343 [ACK] Seq=1 Ack=121218 Win=212992 Len=0,---
128,1.076873,0.000111000,192.168.10.184,192.168.10.196,1460,40880,262144,52343  >  5201 [ACK] Seq=160638 Ack=1 Win=262144 Len=1460,---
129,1.076875,0.000002000,192.168.10.184,192.168.10.196,1460,42340,262144,52343  >  5201 [ACK] Seq=162098 Ack=1 Win=262144 Len=1460,---
130,1.076876,0.000001000,192.168.10.184,192.168.10.196,1460,43800,262144,52343  >  5201 [ACK] Seq=163558 Ack=1 Win=262144 Len=1460,---
131,1.076877,0.000001000,192.168.10.184,192.168.10.196,1460,45260,262144,52343  >  5201 [ACK] Seq=165018 Ack=1 Win=262144 Len=1460,---
132,1.199130,0.122253000,192.168.10.196,192.168.10.184,0,,212992,5201  >  52343 [ACK] Seq=1 Ack=129978 Win=212992 Len=0,---
133,1.199261,0.000131000,192.168.10.184,192.168.10.196,1460,37960,262144,52343  >  5201 [ACK] Seq=166478 Ack=1 Win=262144 Len=1460,---
134,1.199262,0.000001000,192.168.10.184,192.168.10.196,1460,39420,262144,52343  >  5201 [ACK] Seq=167938 Ack=1 Win=262144 Len=1460,---
135,1.199262,0.000000000,192.168.10.184,192.168.10.196,1460,40880,262144,52343  >  5201 [ACK] Seq=169398 Ack=1 Win=262144 Len=1460,---
136,1.199263,0.000001000,192.168.10.184,192.168.10.196,1460,42340,262144,52343  >  5201 [ACK] Seq=170858 Ack=1 Win=262144 Len=1460,---
137,1.199264,0.000001000,192.168.10.184,192.168.10.196,1460,43800,262144,52343  >  5201 [ACK] Seq=172318 Ack=1 Win=262144 Len=1460,---
138,1.199264,0.000000000,192.168.10.184,192.168.10.196,1460,45260,262144,52343  >  5201 [ACK] Seq=173778 Ack=1 Win=262144 Len=1460,---
139,1.199265,0.000001000,192.168.10.184,192.168.10.196,1460,46720,262144,52343  >  5201 [ACK] Seq=175238 Ack=1 Win=262144 Len=1460,---
140,1.199266,0.000001000,192.168.10.184,192.168.10.196,1460,48180,262144,52343  >  5201 [ACK] Seq=176698 Ack=1 Win=262144 Len=1460,---
141,1.200582,0.001316000,192.168.10.196,192.168.10.184,0,,212992,5201  >  52343 [ACK] Seq=1 Ack=147498 Win=212992 Len=0,---
142,1.200727,0.000145000,192.168.10.184,192.168.10.196,1460,32120,262144,52343  >  5201 [ACK] Seq=178158 Ack=1 Win=262144 Len=1460,---
143,1.200728,0.000001000,192.168.10.184,192.168.10.196,1460,33580,262144,52343  >  5201 [ACK] Seq=179618 Ack=1 Win=262144 Len=1460,---
144,1.200729,0.000001000,192.168.10.184,192.168.10.196,1460,35040,262144,52343  >  5201 [ACK] Seq=181078 Ack=1 Win=262144 Len=1460,---
145,1.200730,0.000001000,192.168.10.184,192.168.10.196,1460,36500,262144,52343  >  5201 [ACK] Seq=182538 Ack=1 Win=262144 Len=1460,---
146,1.200730,0.000000000,192.168.10.184,192.168.10.196,1460,37960,262144,52343  >  5201 [ACK] Seq=183998 Ack=1 Win=262144 Len=1460,---
147,1.200731,0.000001000,192.168.10.184,192.168.10.196,1460,39420,262144,52343  >  5201 [ACK] Seq=185458 Ack=1 Win=262144 Len=1460,---
148,1.200732,0.000001000,192.168.10.184,192.168.10.196,1460,40880,262144,52343  >  5201 [ACK] Seq=186918 Ack=1 Win=262144 Len=1460,---
149,1.200732,0.000000000,192.168.10.184,192.168.10.196,1460,42340,262144,52343  >  5201 [ACK] Seq=188378 Ack=1 Win=262144 Len=1460,---
150,1.200733,0.000001000,192.168.10.184,192.168.10.196,1460,43800,262144,52343  >  5201 [ACK] Seq=189838 Ack=1 Win=262144 Len=1460,---
151,1.200734,0.000001000,192.168.10.184,192.168.10.196,1460,45260,262144,52343  >  5201 [ACK] Seq=191298 Ack=1 Win=262144 Len=1460,---
152,1.200734,0.000000000,192.168.10.184,192.168.10.196,1460,46720,262144,52343  >  5201 [ACK] Seq=192758 Ack=1 Win=262144 Len=1460,---
153,1.200735,0.000001000,192.168.10.184,192.168.10.196,1460,48180,262144,52343  >  5201 [ACK] Seq=194218 Ack=1 Win=262144 Len=1460,---
154,1.200736,0.000001000,192.168.10.184,192.168.10.196,1460,49640,262144,52343  >  5201 [ACK] Seq=195678 Ack=1 Win=262144 Len=1460,---
155,1.200736,0.000000000,192.168.10.184,192.168.10.196,1460,51100,262144,52343  >  5201 [ACK] Seq=197138 Ack=1 Win=262144 Len=1460,---
156,1.200851,0.000115000,192.168.10.196,192.168.10.184,0,,212992,5201  >  52343 [ACK] Seq=1 Ack=160638 Win=212992 Len=0,---
157,1.200951,0.000100000,192.168.10.184,192.168.10.196,1460,39420,262144,52343  >  5201 [ACK] Seq=198598 Ack=1 Win=262144 Len=1460,---
158,1.200953,0.000002000,192.168.10.184,192.168.10.196,1460,40880,262144,52343  >  5201 [ACK] Seq=200058 Ack=1 Win=262144 Len=1460,---
159,1.200954,0.000001000,192.168.10.184,192.168.10.196,1460,42340,262144,52343  >  5201 [ACK] Seq=201518 Ack=1 Win=262144 Len=1460,---
160,1.200955,0.000001000,192.168.10.184,192.168.10.196,1460,43800,262144,52343  >  5201 [ACK] Seq=202978 Ack=1 Win=262144 Len=1460,---
161,1.200955,0.000000000,192.168.10.184,192.168.10.196,1460,45260,262144,52343  >  5201 [ACK] Seq=204438 Ack=1 Win=262144 Len=1460,---
162,1.200956,0.000001000,192.168.10.184,192.168.10.196,1460,46720,262144,52343  >  5201 [ACK] Seq=205898 Ack=1 Win=262144 Len=1460,---
163,1.200957,0.000001000,192.168.10.184,192.168.10.196,1460,48180,262144,52343  >  5201 [ACK] Seq=207358 Ack=1 Win=262144 Len=1460,---
164,1.200958,0.000001000,192.168.10.184,192.168.10.196,1460,49640,262144,52343  >  5201 [ACK] Seq=208818 Ack=1 Win=262144 Len=1460,---
165,1.200959,0.000001000,192.168.10.184,192.168.10.196,1460,51100,262144,52343  >  5201 [ACK] Seq=210278 Ack=1 Win=262144 Len=1460,---
166,1.200960,0.000001000,192.168.10.184,192.168.10.196,1460,52560,262144,52343  >  5201 [ACK] Seq=211738 Ack=1 Win=262144 Len=1460,---
167,1.200962,0.000002000,192.168.10.184,192.168.10.196,1460,54020,262144,52343  >  5201 [ACK] Seq=213198 Ack=1 Win=262144 Len=1460,---
168,1.202914,0.001952000,192.168.10.196,192.168.10.184,0,,212992,5201  >  52343 [ACK] Seq=1 Ack=166478 Win=212992 Len=0,---
169,1.203036,0.000122000,192.168.10.184,192.168.10.196,1460,49640,262144,52343  >  5201 [ACK] Seq=214658 Ack=1 Win=262144 Len=1460,---
170,1.203037,0.000001000,192.168.10.184,192.168.10.196,1460,51100,262144,52343  >  5201 [ACK] Seq=216118 Ack=1 Win=262144 Len=1460,---
171,1.203038,0.000001000,192.168.10.184,192.168.10.196,1460,52560,262144,52343  >  5201 [ACK] Seq=217578 Ack=1 Win=262144 Len=1460,---
172,1.203039,0.000001000,192.168.10.184,192.168.10.196,1460,54020,262144,52343  >  5201 [ACK] Seq=219038 Ack=1 Win=262144 Len=1460,---
173,1.203039,0.000000000,192.168.10.184,192.168.10.196,1460,55480,262144,52343  >  5201 [ACK] Seq=220498 Ack=1 Win=262144 Len=1460,---
174,1.203041,0.000002000,192.168.10.184,192.168.10.196,1460,56940,262144,52343  >  5201 [ACK] Seq=221958 Ack=1 Win=262144 Len=1460,---
175,1.324091,0.121050000,192.168.10.196,192.168.10.184,0,,212992,5201  >  52343 [ACK] Seq=1 Ack=176698 Win=212992 Len=0,---
176,1.324219,0.000128000,192.168.10.184,192.168.10.196,1460,48180,262144,52343  >  5201 [ACK] Seq=223418 Ack=1 Win=262144 Len=1460,---
177,1.324221,0.000002000,192.168.10.184,192.168.10.196,1460,49640,262144,52343  >  5201 [ACK] Seq=224878 Ack=1 Win=262144 Len=1460,---
178,1.324222,0.000001000,192.168.10.184,192.168.10.196,1460,51100,262144,52343  >  5201 [ACK] Seq=226338 Ack=1 Win=262144 Len=1460,---
179,1.324223,0.000001000,192.168.10.184,192.168.10.196,1460,52560,262144,52343  >  5201 [ACK] Seq=227798 Ack=1 Win=262144 Len=1460,---
180,1.324225,0.000002000,192.168.10.184,192.168.10.196,1460,54020,262144,52343  >  5201 [ACK] Seq=229258 Ack=1 Win=262144 Len=1460,---
181,1.324225,0.000000000,192.168.10.184,192.168.10.196,1460,55480,262144,52343  >  5201 [ACK] Seq=230718 Ack=1 Win=262144 Len=1460,---
182,1.324226,0.000001000,192.168.10.184,192.168.10.196,1460,56940,262144,52343  >  5201 [ACK] Seq=232178 Ack=1 Win=262144 Len=1460,---
183,1.324228,0.000002000,192.168.10.184,192.168.10.196,1460,58400,262144,52343  >  5201 [ACK] Seq=233638 Ack=1 Win=262144 Len=1460,---
184,1.324229,0.000001000,192.168.10.184,192.168.10.196,1460,59860,262144,52343  >  5201 [ACK] Seq=235098 Ack=1 Win=262144 Len=1460,---
185,1.325678,0.001449000,192.168.10.196,192.168.10.184,0,,212992,5201  >  52343 [ACK] Seq=1 Ack=178158 Win=212992 Len=0,---
186,1.325780,0.000102000,192.168.10.184,192.168.10.196,1460,59860,262144,52343  >  5201 [ACK] Seq=236558 Ack=1 Win=262144 Len=1460,---
187,1.325781,0.000001000,192.168.10.184,192.168.10.196,1460,61320,262144,52343  >  5201 [ACK] Seq=238018 Ack=1 Win=262144 Len=1460,---
188,1.327653,0.001872000,192.168.10.196,192.168.10.184,0,,212992,5201  >  52343 [ACK] Seq=1 Ack=198598 Win=212992 Len=0,---
189,1.327809,0.000156000,192.168.10.184,192.168.10.196,1460,42340,262144,52343  >  5201 [ACK] Seq=239478 Ack=1 Win=262144 Len=1460,---
190,1.327811,0.000002000,192.168.10.184,192.168.10.196,1460,43800,262144,52343  >  5201 [ACK] Seq=240938 Ack=1 Win=262144 Len=1460,---
191,1.327811,0.000000000,192.168.10.184,192.168.10.196,1460,45260,262144,52343  >  5201 [ACK] Seq=242398 Ack=1 Win=262144 Len=1460,---
192,1.327812,0.000001000,192.168.10.184,192.168.10.196,1460,46720,262144,52343  >  5201 [ACK] Seq=243858 Ack=1 Win=262144 Len=1460,---
193,1.327813,0.000001000,192.168.10.184,192.168.10.196,1460,48180,262144,52343  >  5201 [ACK] Seq=245318 Ack=1 Win=262144 Len=1460,---
194,1.327814,0.000001000,192.168.10.184,192.168.10.196,1460,49640,262144,52343  >  5201 [ACK] Seq=246778 Ack=1 Win=262144 Len=1460,---
195,1.327815,0.000001000,192.168.10.184,192.168.10.196,1460,51100,262144,52343  >  5201 [ACK] Seq=248238 Ack=1 Win=262144 Len=1460,---
196,1.327816,0.000001000,192.168.10.184,192.168.10.196,1460,52560,262144,52343  >  5201 [ACK] Seq=249698 Ack=1 Win=262144 Len=1460,---
197,1.327817,0.000001000,192.168.10.184,192.168.10.196,1460,54020,262144,52343  >  5201 [ACK] Seq=251158 Ack=1 Win=262144 Len=1460,---
198,1.327818,0.000001000,192.168.10.184,192.168.10.196,1460,55480,262144,52343  >  5201 [ACK] Seq=252618 Ack=1 Win=262144 Len=1460,---
199,1.327819,0.000001000,192.168.10.184,192.168.10.196,1460,56940,262144,52343  >  5201 [ACK] Seq=254078 Ack=1 Win=262144 Len=1460,---
200,1.327820,0.000001000,192.168.10.184,192.168.10.196,1460,58400,262144,52343  >  5201 [ACK] Seq=255538 Ack=1 Win=262144 Len=1460,---
201,1.327821,0.000001000,192.168.10.184,192.168.10.196,1460,59860,262144,52343  >  5201 [ACK] Seq=256998 Ack=1 Win=262144 Len=1460,---
202,1.327822,0.000001000,192.168.10.184,192.168.10.196,1460,61320,262144,52343  >  5201 [ACK] Seq=258458 Ack=1 Win=262144 Len=1460,---
203,1.327823,0.000001000,192.168.10.184,192.168.10.196,1460,62780,262144,52343  >  5201 [ACK] Seq=259918 Ack=1 Win=262144 Len=1460,---
204,1.327824,0.000001000,192.168.10.184,192.168.10.196,1460,64240,262144,52343  >  5201 [ACK] Seq=261378 Ack=1 Win=262144 Len=1460,---
205,1.328604,0.000780000,192.168.10.196,192.168.10.184,0,,212992,5201  >  52343 [ACK] Seq=1 Ack=201518 Win=212992 Len=0,---
206,1.328722,0.000118000,192.168.10.184,192.168.10.196,1460,62780,262144,52343  >  5201 [ACK] Seq=262838 Ack=1 Win=262144 Len=1460,---
207,1.328723,0.000001000,192.168.10.184,192.168.10.196,1460,64240,262144,52343  >  5201 [ACK] Seq=264298 Ack=1 Win=262144 Len=1460,---
208,1.328724,0.000001000,192.168.10.184,192.168.10.196,1460,65700,262144,52343  >  5201 [ACK] Seq=265758 Ack=1 Win=262144 Len=1460,---
209,1.328724,0.000000000,192.168.10.184,192.168.10.196,1460,67160,262144,52343  >  5201 [ACK] Seq=267218 Ack=1 Win=262144 Len=1460,---
210,1.329129,0.000405000,192.168.10.196,192.168.10.184,0,,212992,5201  >  52343 [ACK] Seq=1 Ack=214658 Win=212992 Len=0,---
211,1.329231,0.000102000,192.168.10.184,192.168.10.196,1460,55480,262144,52343  >  5201 [ACK] Seq=268678 Ack=1 Win=262144 Len=1460,---
212,1.329232,0.000001000,192.168.10.184,192.168.10.196,1460,56940,262144,52343  >  5201 [ACK] Seq=270138 Ack=1 Win=262144 Len=1460,---
213,1.329233,0.000001000,192.168.10.184,192.168.10.196,1460,58400,262144,52343  >  5201 [ACK] Seq=271598 Ack=1 Win=262144 Len=1460,---
214,1.329234,0.000001000,192.168.10.184,192.168.10.196,1460,59860,262144,52343  >  5201 [ACK] Seq=273058 Ack=1 Win=262144 Len=1460,---
215,1.329235,0.000001000,192.168.10.184,192.168.10.196,1460,61320,262144,52343  >  5201 [ACK] Seq=274518 Ack=1 Win=262144 Len=1460,---
216,1.329236,0.000001000,192.168.10.184,192.168.10.196,1460,62780,262144,52343  >  5201 [ACK] Seq=275978 Ack=1 Win=262144 Len=1460,---
217,1.329237,0.000001000,192.168.10.184,192.168.10.196,1460,64240,262144,52343  >  5201 [ACK] Seq=277438 Ack=1 Win=262144 Len=1460,---
218,1.329238,0.000001000,192.168.10.184,192.168.10.196,1460,65700,262144,52343  >  5201 [ACK] Seq=278898 Ack=1 Win=262144 Len=1460,---
219,1.329239,0.000001000,192.168.10.184,192.168.10.196,1460,67160,262144,52343  >  5201 [ACK] Seq=280358 Ack=1 Win=262144 Len=1460,---
220,1.329240,0.000001000,192.168.10.184,192.168.10.196,1460,68620,262144,52343  >  5201 [ACK] Seq=281818 Ack=1 Win=262144 Len=1460,---
221,1.329241,0.000001000,192.168.10.184,192.168.10.196,1460,70080,262144,52343  >  5201 [ACK] Seq=283278 Ack=1 Win=262144 Len=1460,---
222,1.332147,0.002906000,192.168.10.196,192.168.10.184,0,,212992,5201  >  52343 [ACK] Seq=1 Ack=223418 Win=212992 Len=0,---
223,1.332267,0.000120000,192.168.10.184,192.168.10.196,1460,62780,262144,52343  >  5201 [ACK] Seq=284738 Ack=1 Win=262144 Len=1460,---
224,1.332268,0.000001000,192.168.10.184,192.168.10.196,1460,64240,262144,52343  >  5201 [ACK] Seq=286198 Ack=1 Win=262144 Len=1460,---
225,1.332270,0.000002000,192.168.10.184,192.168.10.196,1460,65700,262144,52343  >  5201 [ACK] Seq=287658 Ack=1 Win=262144 Len=1460,---
226,1.332270,0.000000000,192.168.10.184,192.168.10.196,1460,67160,262144,52343  >  5201 [ACK] Seq=289118 Ack=1 Win=262144 Len=1460,---
227,1.332271,0.000001000,192.168.10.184,192.168.10.196,1460,68620,262144,52343  >  5201 [ACK] Seq=290578 Ack=1 Win=262144 Len=1460,---
228,1.332272,0.000001000,192.168.10.184,192.168.10.196,1460,70080,262144,52343  >  5201 [ACK] Seq=292038 Ack=1 Win=262144 Len=1460,---
229,1.332273,0.000001000,192.168.10.184,192.168.10.196,1460,71540,262144,52343  >  5201 [ACK] Seq=293498 Ack=1 Win=262144 Len=1460,---
230,1.332274,0.000001000,192.168.10.184,192.168.10.196,1460,73000,262144,52343  >  5201 [ACK] Seq=294958 Ack=1 Win=262144 Len=1460,---
231,1.437315,0.105041000,192.168.10.196,192.168.10.184,0,,212992,5201  >  52343 [ACK] Seq=1 Ack=236558 Win=212992 Len=0,---
232,1.437391,0.000076000,192.168.10.184,192.168.10.196,1460,61320,262144,52343  >  5201 [ACK] Seq=296418 Ack=1 Win=262144 Len=1460,---
233,1.437391,0.000000000,192.168.10.184,192.168.10.196,1460,62780,262144,52343  >  5201 [ACK] Seq=297878 Ack=1 Win=262144 Len=1460,---
234,1.437391,0.000000000,192.168.10.184,192.168.10.196,1460,64240,262144,52343  >  5201 [ACK] Seq=299338 Ack=1 Win=262144 Len=1460,---
235,1.437392,0.000001000,192.168.10.184,192.168.10.196,1460,65700,262144,52343  >  5201 [ACK] Seq=300798 Ack=1 Win=262144 Len=1460,---
236,1.437392,0.000000000,192.168.10.184,192.168.10.196,1460,67160,262144,52343  >  5201 [ACK] Seq=302258 Ack=1 Win=262144 Len=1460,---
237,1.437393,0.000001000,192.168.10.184,192.168.10.196,1460,68620,262144,52343  >  5201 [ACK] Seq=303718 Ack=1 Win=262144 Len=1460,---
238,1.437393,0.000000000,192.168.10.184,192.168.10.196,1460,70080,262144,52343  >  5201 [ACK] Seq=305178 Ack=1 Win=262144 Len=1460,---
239,1.437393,0.000000000,192.168.10.184,192.168.10.196,1460,71540,262144,52343  >  5201 [ACK] Seq=306638 Ack=1 Win=262144 Len=1460,---
240,1.437394,0.000001000,192.168.10.184,192.168.10.196,1460,73000,262144,52343  >  5201 [ACK] Seq=308098 Ack=1 Win=262144 Len=1460,---
241,1.437394,0.000000000,192.168.10.184,192.168.10.196,1460,74460,262144,52343  >  5201 [ACK] Seq=309558 Ack=1 Win=262144 Len=1460,---
242,1.437394,0.000000000,192.168.10.184,192.168.10.196,1460,75920,262144,52343  >  5201 [ACK] Seq=311018 Ack=1 Win=262144 Len=1460,---
243,1.438062,0.000668000,192.168.10.196,192.168.10.184,0,,212992,5201  >  52343 [ACK] Seq=1 Ack=239478 Win=212992 Len=0,---
244,1.438103,0.000041000,192.168.10.184,192.168.10.196,1460,74460,262144,52343  >  5201 [ACK] Seq=312478 Ack=1 Win=262144 Len=1460,---
245,1.438103,0.000000000,192.168.10.184,192.168.10.196,1460,75920,262144,52343  >  5201 [ACK] Seq=313938 Ack=1 Win=262144 Len=1460,---
246,1.438104,0.000001000,192.168.10.184,192.168.10.196,1460,77380,262144,52343  >  5201 [ACK] Seq=315398 Ack=1 Win=262144 Len=1460,---
247,1.438104,0.000000000,192.168.10.184,192.168.10.196,1460,78840,262144,52343  >  5201 [ACK] Seq=316858 Ack=1 Win=262144 Len=1460,---
248,1.440734,0.002630000,192.168.10.196,192.168.10.184,0,,212992,5201  >  52343 [ACK] Seq=1 Ack=262838 Win=212992 Len=0,---
249,1.440788,0.000054000,192.168.10.184,192.168.10.196,1460,56940,262144,52343  >  5201 [ACK] Seq=318318 Ack=1 Win=262144 Len=1460,---
250,1.440788,0.000000000,192.168.10.184,192.168.10.196,1460,58400,262144,52343  >  5201 [ACK] Seq=319778 Ack=1 Win=262144 Len=1460,---
251,1.440789,0.000001000,192.168.10.184,192.168.10.196,1460,59860,262144,52343  >  5201 [ACK] Seq=321238 Ack=1 Win=262144 Len=1460,---
252,1.440789,0.000000000,192.168.10.184,192.168.10.196,1460,61320,262144,52343  >  5201 [ACK] Seq=322698 Ack=1 Win=262144 Len=1460,---
253,1.440789,0.000000000,192.168.10.184,192.168.10.196,1460,62780,262144,52343  >  5201 [ACK] Seq=324158 Ack=1 Win=262144 Len=1460,---
254,1.440790,0.000001000,192.168.10.184,192.168.10.196,1460,64240,262144,52343  >  5201 [ACK] Seq=325618 Ack=1 Win=262144 Len=1460,---
255,1.440790,0.000000000,192.168.10.184,192.168.10.196,1460,65700,262144,52343  >  5201 [ACK] Seq=327078 Ack=1 Win=262144 Len=1460,---
256,1.440790,0.000000000,192.168.10.184,192.168.10.196,1460,67160,262144,52343  >  5201 [ACK] Seq=328538 Ack=1 Win=262144 Len=1460,---
257,1.440791,0.000001000,192.168.10.184,192.168.10.196,1460,68620,262144,52343  >  5201 [ACK] Seq=329998 Ack=1 Win=262144 Len=1460,---
258,1.440791,0.000000000,192.168.10.184,192.168.10.196,1460,70080,262144,52343  >  5201 [ACK] Seq=331458 Ack=1 Win=262144 Len=1460,---
259,1.440792,0.000001000,192.168.10.184,192.168.10.196,1460,71540,262144,52343  >  5201 [ACK] Seq=332918 Ack=1 Win=262144 Len=1460,---
260,1.440792,0.000000000,192.168.10.184,192.168.10.196,1460,73000,262144,52343  >  5201 [ACK] Seq=334378 Ack=1 Win=262144 Len=1460,---
261,1.440793,0.000001000,192.168.10.184,192.168.10.196,1460,74460,262144,52343  >  5201 [ACK] Seq=335838 Ack=1 Win=262144 Len=1460,---
262,1.440793,0.000000000,192.168.10.184,192.168.10.196,1460,75920,262144,52343  >  5201 [ACK] Seq=337298 Ack=1 Win=262144 Len=1460,---
263,1.440793,0.000000000,192.168.10.184,192.168.10.196,1460,77380,262144,52343  >  5201 [ACK] Seq=338758 Ack=1 Win=262144 Len=1460,---
264,1.440794,0.000001000,192.168.10.184,192.168.10.196,1460,78840,262144,52343  >  5201 [ACK] Seq=340218 Ack=1 Win=262144 Len=1460,---
265,1.440794,0.000000000,192.168.10.184,192.168.10.196,1460,80300,262144,52343  >  5201 [ACK] Seq=341678 Ack=1 Win=262144 Len=1460,---
266,1.440794,0.000000000,192.168.10.184,192.168.10.196,1460,81760,262144,52343  >  5201 [ACK] Seq=343138 Ack=1 Win=262144 Len=1460,---
267,1.441423,0.000629000,192.168.10.196,192.168.10.184,0,,212992,5201  >  52343 [ACK] Seq=1 Ack=268678 Win=212992 Len=0,---
268,1.441461,0.000038000,192.168.10.184,192.168.10.196,1460,77380,262144,52343  >  5201 [ACK] Seq=344598 Ack=1 Win=262144 Len=1460,---
269,1.441461,0.000000000,192.168.10.184,192.168.10.196,1460,78840,262144,52343  >  5201 [ACK] Seq=346058 Ack=1 Win=262144 Len=1460,---
270,1.441462,0.000001000,192.168.10.184,192.168.10.196,1460,80300,262144,52343  >  5201 [ACK] Seq=347518 Ack=1 Win=262144 Len=1460,---
271,1.441462,0.000000000,192.168.10.184,192.168.10.196,1460,81760,262144,52343  >  5201 [ACK] Seq=348978 Ack=1 Win=262144 Len=1460,---
272,1.441463,0.000001000,192.168.10.184,192.168.10.196,1460,83220,262144,52343  >  5201 [ACK] Seq=350438 Ack=1 Win=262144 Len=1460,---
273,1.441463,0.000000000,192.168.10.184,192.168.10.196,1460,84680,262144,52343  >  5201 [ACK] Seq=351898 Ack=1 Win=262144 Len=1460,---
274,1.445058,0.003595000,192.168.10.196,192.168.10.184,0,,212992,5201  >  52343 [ACK] Seq=1 Ack=284738 Win=212992 Len=0,---
275,1.445112,0.000054000,192.168.10.184,192.168.10.196,1460,70080,262144,52343  >  5201 [ACK] Seq=353358 Ack=1 Win=262144 Len=1460,---
276,1.445112,0.000000000,192.168.10.184,192.168.10.196,1460,71540,262144,52343  >  5201 [ACK] Seq=354818 Ack=1 Win=262144 Len=1460,---
277,1.445113,0.000001000,192.168.10.184,192.168.10.196,1460,73000,262144,52343  >  5201 [ACK] Seq=356278 Ack=1 Win=262144 Len=1460,---
278,1.445113,0.000000000,192.168.10.184,192.168.10.196,1460,74460,262144,52343  >  5201 [ACK] Seq=357738 Ack=1 Win=262144 Len=1460,---
279,1.445113,0.000000000,192.168.10.184,192.168.10.196,1460,75920,262144,52343  >  5201 [ACK] Seq=359198 Ack=1 Win=262144 Len=1460,---
280,1.445114,0.000001000,192.168.10.184,192.168.10.196,1460,77380,262144,52343  >  5201 [ACK] Seq=360658 Ack=1 Win=262144 Len=1460,---
281,1.445114,0.000000000,192.168.10.184,192.168.10.196,1460,78840,262144,52343  >  5201 [ACK] Seq=362118 Ack=1 Win=262144 Len=1460,---
282,1.445115,0.000001000,192.168.10.184,192.168.10.196,1460,80300,262144,52343  >  5201 [ACK] Seq=363578 Ack=1 Win=262144 Len=1460,---
283,1.445115,0.000000000,192.168.10.184,192.168.10.196,1460,81760,262144,52343  >  5201 [ACK] Seq=365038 Ack=1 Win=262144 Len=1460,---
284,1.445115,0.000000000,192.168.10.184,192.168.10.196,1460,83220,262144,52343  >  5201 [ACK] Seq=366498 Ack=1 Win=262144 Len=1460,---
285,1.445116,0.000001000,192.168.10.184,192.168.10.196,1460,84680,262144,52343  >  5201 [ACK] Seq=367958 Ack=1 Win=262144 Len=1460,---
286,1.445116,0.000000000,192.168.10.184,192.168.10.196,1460,86140,262144,52343  >  5201 [ACK] Seq=369418 Ack=1 Win=262144 Len=1460,---
287,1.445117,0.000001000,192.168.10.184,192.168.10.196,1460,87600,262144,52343  >  5201 [ACK] Seq=370878 Ack=1 Win=262144 Len=1460,---
288,1.445367,0.000250000,192.168.10.196,192.168.10.184,0,,212992,5201  >  52343 [ACK] Seq=1 Ack=296418 Win=212992 Len=0,---
289,1.445408,0.000041000,192.168.10.184,192.168.10.196,1460,77380,262144,52343  >  5201 [ACK] Seq=372338 Ack=1 Win=262144 Len=1460,---
290,1.445409,0.000001000,192.168.10.184,192.168.10.196,1460,78840,262144,52343  >  5201 [ACK] Seq=373798 Ack=1 Win=262144 Len=1460[Packet size limited during capture],---
291,1.445409,0.000000000,192.168.10.184,192.168.10.196,1460,80300,262144,52343  >  5201 [ACK] Seq=375258 Ack=1 Win=262144 Len=1460,---
292,1.445410,0.000001000,192.168.10.184,192.168.10.196,1460,81760,262144,52343  >  5201 [ACK] Seq=376718 Ack=1 Win=262144 Len=1460,---
293,1.445411,0.000001000,192.168.10.184,192.168.10.196,1460,83220,262144,52343  >  5201 [ACK] Seq=378178 Ack=1 Win=262144 Len=1460,---
294,1.445411,0.000000000,192.168.10.184,192.168.10.196,1460,84680,262144,52343  >  5201 [ACK] Seq=379638 Ack=1 Win=262144 Len=1460,---
295,1.445412,0.000001000,192.168.10.184,192.168.10.196,1460,86140,262144,52343  >  5201 [ACK] Seq=381098 Ack=1 Win=262144 Len=1460,---
296,1.445412,0.000000000,192.168.10.184,192.168.10.196,1460,87600,262144,52343  >  5201 [ACK] Seq=382558 Ack=1 Win=262144 Len=1460[Packet size limited during capture],---
